{"created_at":"2026-09-20T04:00:00Z","created_by":"human-demo","edges":[],"graph_id":"G-701","intent_id":"I-701","intent_version":1,"nodes":[{"eu_id":"EU-001","requirement_ids":["REQ-001"]},{"eu_id":"EU-002","requirement_ids":["REQ-002"]}],"project_id":"human-demo","reason":"small independent demo units","schema_version":1,"source_event_id":"demo-graph-created","status":"ACTIVE","version":1}
